{
  "deliveryId": "77777777-7777-4777-8777-777777777777",
  "tradeId": "88888888-8888-4888-8888-888888888888",
  "onChainTradeId": 999,

  "sellerId": "11111111-1111-4111-8111-111111111111",
  "buyerId": "22222222-2222-4222-8222-222222222222",

  "expectedWh": 4000,
  "deliveredWh": 4000,

  "timeSlot": "2026-10-17T14:30:00Z",

  "status": "SUCCESS"
}
